{
  "schema": {
    "id": "sneed.fault-tree",
    "version": 1
  },
  "model": {
    "id": "m1",
    "name": "Fixture",
    "created": "2026-10-05T00:00:00Z",
    "updated": "2026-10-05T00:00:00Z"
  },
  "assumptions": {
    "probability_model": "constant",
    "independence": "beta-factor-groups",
    "coherence": "coherent",
    "time": "none"
  },
  "top": "TOP",
  "events": [
    {
      "id": "A",
      "probability": 0.1
    },
    {
      "id": "B",
      "probability": 0.1
    },
    {
      "id": "C",
      "probability": 0.2
    },
    {
      "id": "D",
      "probability": 0.2
    }
  ],
  "gates": [
    {
      "id": "TOP",
      "type": "or",
      "inputs": [
        "P1",
        "P2"
      ]
    },
    {
      "id": "P1",
      "type": "and",
      "inputs": [
        "A",
        "B"
      ]
    },
    {
      "id": "P2",
      "type": "and",
      "inputs": [
        "C",
        "D"
      ]
    }
  ],
  "common_cause_groups": [
    {
      "id": "G1",
      "method": "beta-factor",
      "members": [
        "A",
        "B"
      ],
      "beta": 0.1
    },
    {
      "id": "G2",
      "method": "beta-factor",
      "members": [
        "C",
        "D"
      ],
      "beta": 0.2
    }
  ]
}
