{
  "schema": {
    "id": "sneed.fault-tree",
    "version": 1
  },
  "model": {
    "id": "m1",
    "name": "Fixture",
    "created": "2026-10-05T00:00:00Z",
    "updated": "2026-10-05T00:00:00Z"
  },
  "assumptions": {
    "probability_model": "constant",
    "independence": "declared-independent",
    "coherence": "coherent",
    "time": "none"
  },
  "top": "P",
  "events": [
    {
      "id": "P",
      "probability": 0.1
    }
  ],
  "gates": []
}
